number,value,datetime_start,datetime_complete,duration,params_gb_learning_rate,params_gb_max_depth,params_gb_min_samples_leaf,params_gb_n_estimators,params_gb_subsample,params_lr_C,params_lr_solver,params_model_type,params_rf_max_depth,params_rf_max_features,params_rf_min_samples_leaf,params_rf_min_samples_split,params_rf_n_estimators,user_attrs_log_loss_std,user_attrs_model_type,state
0,1.1253022637675276,2026-02-27 17:38:06.489086,2026-02-27 17:38:08.542632,0 days 00:00:02.053546,,,,,,,,RandomForest,5.0,sqrt,12.0,3.0,500.0,0.030304512401070748,RandomForest,COMPLETE
1,1.1212307224499,2026-02-27 17:38:08.545646,2026-02-27 17:38:09.635385,0 days 00:00:01.089739,,,,,,,,RandomForest,5.0,sqrt,13.0,10.0,250.0,0.02616728346636027,RandomForest,COMPLETE
2,1.1115418681788682,2026-02-27 17:38:09.636369,2026-02-27 17:38:09.654534,0 days 00:00:00.018165,,,,,,0.06789053271698488,saga,LogisticRegression,,,,,,0.14459515655560254,LogisticRegression,COMPLETE
3,1.1233905539878042,2026-02-27 17:38:09.654534,2026-02-27 17:38:09.971285,0 days 00:00:00.316751,0.07896186801026692,3.0,48.0,100.0,0.6260206371941118,,,GradientBoosting,,,,,,0.08590161340565237,GradientBoosting,COMPLETE
4,1.1310773526892781,2026-02-27 17:38:09.972309,2026-02-27 17:38:10.008151,0 days 00:00:00.035842,,,,,,0.0030786517836196197,lbfgs,LogisticRegression,,,,,,0.09259700245691554,LogisticRegression,COMPLETE
5,1.100292669858725,2026-02-27 17:38:10.009165,2026-02-27 17:38:12.978679,0 days 00:00:02.969514,,,,,,,,RandomForest,6.0,log2,35.0,11.0,750.0,0.00523218970556823,RandomForest,COMPLETE
6,1.814530691914117,2026-02-27 17:38:12.980186,2026-02-27 17:38:12.990350,0 days 00:00:00.010164,,,,,,29.79454462591363,saga,LogisticRegression,,,,,,1.3729923021836907,LogisticRegression,COMPLETE
7,1.1035748024733534,2026-02-27 17:38:12.990350,2026-02-27 17:38:14.279989,0 days 00:00:01.289639,,,,,,,,RandomForest,8.0,,17.0,26.0,300.0,0.0050543194156945645,RandomForest,COMPLETE
8,1.1119916681361903,2026-02-27 17:38:14.281010,2026-02-27 17:38:17.420676,0 days 00:00:03.139666,,,,,,,,RandomForest,13.0,sqrt,14.0,2.0,800.0,0.021996286654269816,RandomForest,COMPLETE
9,1.129477828082875,2026-02-27 17:38:17.421210,2026-02-27 17:38:17.438446,0 days 00:00:00.017236,,,,,,0.0037961668958008117,lbfgs,LogisticRegression,,,,,,0.09291017424490502,LogisticRegression,COMPLETE
10,1.2225171893675775,2026-02-27 17:38:17.439448,2026-02-27 17:38:19.684338,0 days 00:00:02.244890,0.010260022325256595,10.0,6.0,550.0,0.9883416332150827,,,GradientBoosting,,,,,,0.23110168779711665,GradientBoosting,COMPLETE
11,1.1032024677266534,2026-02-27 17:38:19.685355,2026-02-27 17:38:20.354855,0 days 00:00:00.669500,,,,,,,,RandomForest,9.0,log2,38.0,26.0,150.0,0.007078278054607741,RandomForest,COMPLETE
12,1.1072898108594311,2026-02-27 17:38:20.355854,2026-02-27 17:38:20.871259,0 days 00:00:00.515405,,,,,,,,RandomForest,10.0,log2,40.0,18.0,100.0,0.01737784402252075,RandomForest,COMPLETE
13,1.0995122776422037,2026-02-27 17:38:20.872257,2026-02-27 17:38:23.389230,0 days 00:00:02.516973,,,,,,,,RandomForest,8.0,log2,32.0,30.0,650.0,0.0035807238309110505,RandomForest,COMPLETE
14,1.0995122776422037,2026-02-27 17:38:23.390853,2026-02-27 17:38:25.945253,0 days 00:00:02.554400,,,,,,,,RandomForest,3.0,log2,30.0,30.0,650.0,0.003580723830911027,RandomForest,COMPLETE
15,1.1001861048667452,2026-02-27 17:38:25.946796,2026-02-27 17:38:28.450478,0 days 00:00:02.503682,,,,,,,,RandomForest,3.0,log2,28.0,30.0,600.0,0.0047540433070781965,RandomForest,COMPLETE
16,1.148860850334711,2026-02-27 17:38:28.451492,2026-02-27 17:38:29.359007,0 days 00:00:00.907515,0.28352587842331306,6.0,27.0,300.0,0.8066305882008067,,,GradientBoosting,,,,,,0.08010997140934216,GradientBoosting,COMPLETE
17,1.1001861048667452,2026-02-27 17:38:29.359990,2026-02-27 17:38:31.738425,0 days 00:00:02.378435,,,,,,,,RandomForest,3.0,log2,49.0,30.0,600.0,0.004754043307078266,RandomForest,COMPLETE
18,1.1012315257442977,2026-02-27 17:38:31.740073,2026-02-27 17:38:33.531010,0 days 00:00:01.790937,,,,,,,,RandomForest,15.0,,27.0,21.0,450.0,0.006155230104755792,RandomForest,COMPLETE
19,1.1441753770767509,2026-02-27 17:38:33.533018,2026-02-27 17:38:34.741107,0 days 00:00:01.208089,0.03599554864219772,2.0,28.0,400.0,0.7911302960155628,,,GradientBoosting,,,,,,0.09716178325922442,GradientBoosting,COMPLETE
20,1.1000452402259364,2026-02-27 17:38:34.742156,2026-02-27 17:38:37.930451,0 days 00:00:03.188295,,,,,,,,RandomForest,7.0,log2,29.0,30.0,700.0,0.004219606632300023,RandomForest,COMPLETE
21,1.0995122776422037,2026-02-27 17:38:37.931113,2026-02-27 17:38:40.730265,0 days 00:00:02.799152,,,,,,,,RandomForest,7.0,log2,28.0,30.0,650.0,0.003580723830911027,RandomForest,COMPLETE
22,1.1001861048667452,2026-02-27 17:38:40.730833,2026-02-27 17:38:43.061645,0 days 00:00:02.330812,,,,,,,,RandomForest,8.0,log2,26.0,30.0,600.0,0.0047540433070781965,RandomForest,COMPLETE
23,1.1000452402259364,2026-02-27 17:38:43.062650,2026-02-27 17:38:45.841718,0 days 00:00:02.779068,,,,,,,,RandomForest,3.0,log2,33.0,23.0,700.0,0.00421960663230001,RandomForest,COMPLETE
24,1.0997369512154314,2026-02-27 17:38:45.842225,2026-02-27 17:38:48.040278,0 days 00:00:02.198053,,,,,,,,RandomForest,11.0,log2,26.0,30.0,550.0,0.003979274655602802,RandomForest,COMPLETE
25,1.0995122776422037,2026-02-27 17:38:48.041327,2026-02-27 17:38:50.801701,0 days 00:00:02.760374,,,,,,,,RandomForest,7.0,log2,36.0,24.0,650.0,0.003580723830911049,RandomForest,COMPLETE
26,1.0977363849565427,2026-02-27 17:38:50.803740,2026-02-27 17:38:54.061801,0 days 00:00:03.258061,,,,,,,,RandomForest,6.0,,23.0,30.0,800.0,,,PRUNED
27,1.1004525529820584,2026-02-27 17:38:54.062829,2026-02-27 17:38:56.068422,0 days 00:00:02.005593,,,,,,,,RandomForest,9.0,log2,34.0,24.0,500.0,0.005149061826381022,RandomForest,COMPLETE
28,1.1492913441290469,2026-02-27 17:38:56.068945,2026-02-27 17:38:58.087103,0 days 00:00:02.018158,0.026790681928799312,7.0,16.0,600.0,0.8915855181058915,,,GradientBoosting,,,,,,0.08905640257943544,GradientBoosting,COMPLETE
29,1.2566750053330267,2026-02-27 17:38:58.087758,2026-02-27 17:38:58.106482,0 days 00:00:00.018724,,,,,,1.2777680318134705,lbfgs,LogisticRegression,,,,,,0.37929428713224,LogisticRegression,COMPLETE
30,1.0995122776422037,2026-02-27 17:38:58.107474,2026-02-27 17:39:00.854525,0 days 00:00:02.747051,,,,,,,,RandomForest,5.0,log2,24.0,30.0,650.0,0.003580723830911049,RandomForest,COMPLETE
31,1.0995122776422037,2026-02-27 17:39:00.854525,2026-02-27 17:39:03.600251,0 days 00:00:02.745726,,,,,,,,RandomForest,7.0,log2,36.0,23.0,650.0,0.0035807238309110254,RandomForest,COMPLETE
32,1.0995122776422037,2026-02-27 17:39:03.601286,2026-02-27 17:39:06.219561,0 days 00:00:02.618275,,,,,,,,RandomForest,7.0,log2,37.0,25.0,650.0,0.003580723830911027,RandomForest,COMPLETE
33,1.0995122776422037,2026-02-27 17:39:06.220072,2026-02-27 17:39:08.735391,0 days 00:00:02.515319,,,,,,,,RandomForest,8.0,log2,33.0,25.0,650.0,0.003580723830911049,RandomForest,COMPLETE
34,1.0995122776422037,2026-02-27 17:39:08.736890,2026-02-27 17:39:11.287834,0 days 00:00:02.550944,,,,,,,,RandomForest,6.0,log2,44.0,30.0,650.0,0.0035807238309110393,RandomForest,COMPLETE
35,1.100186104866745,2026-02-27 17:39:11.287834,2026-02-27 17:39:13.784492,0 days 00:00:02.496658,,,,,,,,RandomForest,3.0,log2,31.0,25.0,600.0,0.004754043307078297,RandomForest,COMPLETE
36,1.302786274099503,2026-02-27 17:39:13.785495,2026-02-27 17:39:13.794871,0 days 00:00:00.009376,,,,,,1.9456537996334313,saga,LogisticRegression,,,,,,0.44711501560285816,LogisticRegression,COMPLETE
37,1.1002926698587248,2026-02-27 17:39:13.795857,2026-02-27 17:39:16.945962,0 days 00:00:03.150105,,,,,,,,RandomForest,9.0,sqrt,31.0,17.0,750.0,0.005232189705568283,RandomForest,COMPLETE
38,1.0997369512154314,2026-02-27 17:39:16.946960,2026-02-27 17:39:19.526285,0 days 00:00:02.579325,,,,,,,,RandomForest,7.0,,38.0,30.0,550.0,0.00397927465560272,RandomForest,COMPLETE
39,1.1492046096066113,2026-02-27 17:39:19.528285,2026-02-27 17:39:20.145109,0 days 00:00:00.616824,0.09798754082738499,5.0,39.0,200.0,0.7066432400266448,,,GradientBoosting,,,,,,0.09209238175207575,GradientBoosting,COMPLETE
40,2.1314978156278435,2026-02-27 17:39:20.145971,2026-02-27 17:39:20.166267,0 days 00:00:00.020296,,,,,,83.82733744963468,lbfgs,LogisticRegression,,,,,,1.9966136265144336,LogisticRegression,COMPLETE
41,1.0995122776422035,2026-02-27 17:39:20.166267,2026-02-27 17:39:22.597150,0 days 00:00:02.430883,,,,,,,,RandomForest,5.0,log2,23.0,30.0,650.0,0.0035807238309109855,RandomForest,COMPLETE
42,1.0995122776422037,2026-02-27 17:39:22.598205,2026-02-27 17:39:25.048776,0 days 00:00:02.450571,,,,,,,,RandomForest,5.0,log2,24.0,30.0,650.0,0.003580723830911027,RandomForest,COMPLETE
43,1.0995122776422037,2026-02-27 17:39:25.050280,2026-02-27 17:39:27.545848,0 days 00:00:02.495568,,,,,,,,RandomForest,5.0,log2,23.0,30.0,650.0,0.003580723830911049,RandomForest,COMPLETE
44,1.0995122776422037,2026-02-27 17:39:27.546848,2026-02-27 17:39:30.573673,0 days 00:00:03.026825,,,,,,,,RandomForest,5.0,log2,28.0,26.0,650.0,0.003580723830911027,RandomForest,COMPLETE
45,1.0997369512154314,2026-02-27 17:39:30.574676,2026-02-27 17:39:32.885462,0 days 00:00:02.310786,,,,,,,,RandomForest,7.0,log2,31.0,30.0,550.0,0.0039792746556028885,RandomForest,COMPLETE
46,1.123725109181699,2026-02-27 17:39:32.886463,2026-02-27 17:39:35.561559,0 days 00:00:02.675096,,,,,,,,RandomForest,3.0,sqrt,8.0,26.0,700.0,0.03158918433251732,RandomForest,COMPLETE
47,1.1001673539455636,2026-02-27 17:39:35.562562,2026-02-27 17:39:38.226098,0 days 00:00:02.663536,,,,,,,,RandomForest,6.0,log2,18.0,30.0,700.0,0.0041621912321600655,RandomForest,COMPLETE
48,1.1182640764686205,2026-02-27 17:39:38.227098,2026-02-27 17:39:38.236278,0 days 00:00:00.009180,,,,,,0.10900458545827559,saga,LogisticRegression,,,,,,0.16957272397135995,LogisticRegression,COMPLETE
49,1.0997369512154314,2026-02-27 17:39:38.237266,2026-02-27 17:39:40.428027,0 days 00:00:02.190761,,,,,,,,RandomForest,5.0,sqrt,31.0,26.0,550.0,0.0039792746556027905,RandomForest,COMPLETE
